{
  "schema_version": "1.0.0",
  "plan_id": "pca-7d9f07794518acc909b5",
  "revision": 1,
  "identity": {
    "institution": "UAdeC",
    "program": "medico-cirujano",
    "subject_id": "examen-ingreso-salud-publica",
    "subject_title": "examen-ingreso-salud-publica",
    "offering_id": "oferta-41723c61fcc2189a",
    "period": null,
    "modality": null
  },
  "sources": [
    {
      "id": "src-local",
      "kind": "other",
      "authority": "unknown",
      "title": "consigna-investigacion.md",
      "url": null,
      "path": "planeaciones-examen-ingreso-salud-publica/consigna-investigacion.md",
      "sha256": "0f1462aa718c193bba53aa18de3bef8d9fdc5555c12886b2577f05a835d8bea1",
      "captured_at": null,
      "media_type": "text/plain"
    }
  ],
  "curriculum": {
    "purpose": null,
    "competencies": [],
    "outcomes": [],
    "topics": []
  },
  "activities": [
    {
      "id": "source-0f1462aa718c193b",
      "title": "consigna-investigacion",
      "role": "learning",
      "platform": null,
      "unit_id": null,
      "weeks": [],
      "outcome_ids": [],
      "topic_ids": [],
      "cognitive": {
        "taxonomy": null,
        "level": null,
        "verb": null,
        "object": null,
        "conditions": null,
        "observable_evidence": null,
        "justification": null
      },
      "instruction": "[document]\n# Actividad 01 - Síntesis y representación conceptual\n\nConsigna local AulaTeX; no se presenta como instrucción oficial de UAdeC/CENEVAL.\n\n## Objetivo\n\nRelacionar los conceptos de la guía mediante una síntesis y un esquema o tabla.\n\n## Producto\n\n[Guía](../guia-de-estudio.md), [fuente del reporte](../reporte-examen-ingreso-salud-publica.tex) y PDF compilado junto a esa fuente.\n\n## Criterios\n\n- Conceptos precisos y sin afirmaciones absolutas injustificadas.\n- Fuente y alcance de consulta identificados.\n- Esquema o tabla coherente con la síntesis.\n- Cada reactivo tiene cuatro opciones y una solución justificada.\n- Sin marcadores de contenido pendiente en el producto.\n- Compilación y revisión visual verificadas por separado.\n\nLa resolución modelo no acredita un intento personal; no hay envío ni calificación institucional.\n",
      "requirements": [],
      "questions": [],
      "sequence": [],
      "resources": [],
      "assessment": {
        "kind": null,
        "scale_total": null,
        "weight": null,
        "weight_unit": null,
        "criteria": [],
        "editorial_checks": []
      },
      "products": [],
      "calendar": {
        "opens_at": null,
        "expected_at": null,
        "due_at": null,
        "closes_at": null,
        "timezone": null,
        "literal": null
      },
      "policies": {
        "ai": null,
        "integrity": null,
        "collaboration": null,
        "citation": null,
        "attempts": null,
        "late_submission": null,
        "accessibility": null,
        "privacy": null,
        "exceptions": []
      },
      "dependencies": [],
      "alignment": [],
      "bindings": {
        "extractor_directory": "extractor-aulatex",
        "notes_directory": "referencias-examen-ingreso-salud-publica/notas-examen-ingreso-salud-publica",
        "research_directory": "investigacion-aulatex"
      }
    }
  ],
  "field_status": [
    {
      "path": "/identity",
      "state": "inferred",
      "reason": "Identidad editorial del catalogo; oferta interna, periodo y modalidad no acreditados cuando faltan.",
      "evidence": [],
      "alternatives": []
    },
    {
      "path": "/sources",
      "state": "confirmed",
      "reason": "Archivo local preservado; su huella no acredita autoria ni vigencia docente.",
      "evidence": [
        {
          "source_id": "src-local",
          "locator": "local-file",
          "quoted_text": null
        }
      ],
      "alternatives": []
    },
    {
      "path": "/curriculum",
      "state": "unknown",
      "reason": "No se deducen competencias, resultados ni temario que no esten documentados.",
      "evidence": [],
      "alternatives": []
    },
    {
      "path": "/activities/0",
      "state": "unknown",
      "reason": "Campos sin datos no se completan por inferencia; la consigna puede estar resumida o sin segmentar.",
      "evidence": [],
      "alternatives": []
    },
    {
      "path": "/activities/0/role",
      "state": "inferred",
      "reason": "Clasificacion operativa provisional a partir del tipo original; no impone obligatoriedad.",
      "evidence": [],
      "alternatives": []
    },
    {
      "path": "/activities/0/instruction",
      "state": "inferred",
      "reason": "Texto completo importado o requisitos del modelo local; pendiente cotejo con consigna docente.",
      "evidence": [
        {
          "source_id": "src-local",
          "locator": "document",
          "quoted_text": "[document]\n# Actividad 01 - Síntesis y representación conceptual\n\nConsigna local AulaTeX; no se presenta como instrucción oficial de UAdeC/CENEVAL.\n\n## Objetivo\n\nRelacionar los conceptos de la guía mediante una síntesis y un esquema o tabla.\n\n## Producto\n\n[Guía](../guia-de-estudio.md), [fuente del reporte](../reporte-examen-ingreso-salud-publica.tex) y PDF compilado junto a esa fuente.\n\n## Criterios\n\n- Conceptos precisos y sin afirmaciones absolutas injustificadas.\n- Fuente y alcance de consulta identificados.\n- Esquema o tabla coherente con la síntesis.\n- Cada reactivo tiene cuatro opciones y una solución justificada.\n- Sin marcadores de contenido pendiente en el producto.\n- Compilación y revisión visual verificadas por separado.\n\nLa resolución modelo no acredita un intento personal; no hay envío ni calificación institucional.\n"
        }
      ],
      "alternatives": []
    }
  ],
  "review": {
    "state": "needs_review",
    "reviewed_at": null,
    "reviewer_role": null,
    "critical_gaps": [
      "Cotejar consigna y procedencia docente; conversion local no equivale a aprobacion",
      "Documento sin segmentar: identificar actividades, requisitos, preguntas y rubrica antes de ejecutar"
    ],
    "semantic_validation": "failed"
  },
  "artifact_contract": {
    "version": "1.1",
    "academic_materials_versioned": true,
    "paths_relative_to_subject": {
      "plans": "planeaciones-examen-ingreso-salud-publica",
      "references": "referencias-examen-ingreso-salud-publica",
      "notes": "referencias-examen-ingreso-salud-publica/notas-examen-ingreso-salud-publica",
      "assets": "assets-examen-ingreso-salud-publica",
      "deliveries": "entregas-examen-ingreso-salud-publica",
      "extractions": "extractor-aulatex",
      "research": "investigacion-aulatex"
    },
    "deliverables_directory": "entregas-examen-ingreso-salud-publica",
    "source_directory": "."
  },
  "extensions": {
    "conversion": {
      "version": "1.0",
      "source_format": ".md",
      "source_sha256": "0f1462aa718c193bba53aa18de3bef8d9fdc5555c12886b2577f05a835d8bea1",
      "source_payload": null,
      "source_blocks": [
        {
          "locator": "document",
          "text": "# Actividad 01 - Síntesis y representación conceptual\n\nConsigna local AulaTeX; no se presenta como instrucción oficial de UAdeC/CENEVAL.\n\n## Objetivo\n\nRelacionar los conceptos de la guía mediante una síntesis y un esquema o tabla.\n\n## Producto\n\n[Guía](../guia-de-estudio.md), [fuente del reporte](../reporte-examen-ingreso-salud-publica.tex) y PDF compilado junto a esa fuente.\n\n## Criterios\n\n- Conceptos precisos y sin afirmaciones absolutas injustificadas.\n- Fuente y alcance de consulta identificados.\n- Esquema o tabla coherente con la síntesis.\n- Cada reactivo tiene cuatro opciones y una solución justificada.\n- Sin marcadores de contenido pendiente en el producto.\n- Compilación y revisión visual verificadas por separado.\n\nLa resolución modelo no acredita un intento personal; no hay envío ni calificación institucional.\n"
        }
      ],
      "unsegmented_document": true,
      "period_pending": true,
      "activity_mapping": [
        {
          "activity_id": "source-0f1462aa718c193b",
          "local_number": null,
          "source_locator": "document",
          "source_is_summary": false
        }
      ]
    }
  }
}
